[
  {
    "id": "entity-0001",
    "name": "1 Police Plaza",
    "entity_type": "Government agency location",
    "notes_internal": null
  },
  {
    "id": "entity-0002",
    "name": "13 Harrison LLC",
    "entity_type": "Entity; limited liability company; Unit 2 buyer",
    "notes_internal": null
  },
  {
    "id": "entity-0003",
    "name": "13 Harrison Street",
    "entity_type": "Building Address",
    "notes_internal": null
  },
  {
    "id": "entity-0004",
    "name": "13 Harrison Street Condominium",
    "entity_type": "Entity; condominium building",
    "notes_internal": null
  },
  {
    "id": "entity-0005",
    "name": "1st Precinct (16 Ericsson Place)",
    "entity_type": "Government agency - Police precinct",
    "notes_internal": null
  },
  {
    "id": "entity-0006",
    "name": "1st Precinct NYPD",
    "entity_type": "Law Enforcement",
    "notes_internal": null
  },
  {
    "id": "entity-0007",
    "name": "Abdallah Elcherbini",
    "entity_type": "Individual - Licensed architect, EC Architects",
    "notes_internal": null,
    "aliases": [
      "Elcherbini"
    ]
  },
  {
    "id": "entity-0008",
    "name": "Adam Leitman Bailey, P.C.",
    "entity_type": "Law firm - plaintiff's counsel",
    "notes_internal": null
  },
  {
    "id": "entity-0009",
    "name": "Alexandra Jonas",
    "entity_type": "Individual attorney",
    "notes_internal": null
  },
  {
    "id": "entity-0010",
    "name": "Alexis Bleich",
    "entity_type": "Person - spouse of Michael Bleich",
    "notes_internal": null
  },
  {
    "id": "entity-0011",
    "name": "Anna Pia D. Felix, Esq.",
    "entity_type": "Attorney defendant",
    "notes_internal": null
  },
  {
    "id": "entity-0012",
    "name": "Annabelle Selldorf",
    "entity_type": "Person - architect",
    "notes_internal": null
  },
  {
    "id": "entity-0013",
    "name": "Arnulf",
    "entity_type": "Individual; managing member of 13 Harrison LLC; Unit 2 owner; European-based international businessman",
    "notes_internal": null
  },
  {
    "id": "entity-0014",
    "name": "Attorney defendants",
    "entity_type": "Defendants subject to treble damages under Judiciary Law \u00a7487",
    "notes_internal": null
  },
  {
    "id": "entity-0015",
    "name": "Aziz Ansari",
    "entity_type": "Person - comedian",
    "notes_internal": null
  },
  {
    "id": "entity-0016",
    "name": "Barry Minkow",
    "entity_type": "Individual - Journalist/Financial commentator",
    "notes_internal": null
  },
  {
    "id": "entity-0017",
    "name": "Berry",
    "entity_type": "Individual - Counsel",
    "notes_internal": null
  },
  {
    "id": "entity-0018",
    "name": "Beverley Kerzner-Mace",
    "entity_type": "Person - daughter of Sol Kerzner",
    "notes_internal": null
  },
  {
    "id": "entity-0019",
    "name": "Beyonc\u00e9",
    "entity_type": "Person - musician and real estate investor",
    "notes_internal": null
  },
  {
    "id": "entity-0020",
    "name": "Bleich's counsel",
    "entity_type": "Attorney for defendant",
    "notes_internal": null
  },
  {
    "id": "entity-0023",
    "name": "Board of Managers of 13 Harrison Street Condominium",
    "entity_type": "Entity; governing body",
    "notes_internal": null,
    "aliases": [
      "Board",
      "Board of 13 Harrison Street"
    ]
  },
  {
    "id": "entity-0024",
    "name": "Bowery Appraisal",
    "entity_type": "appraisal firm; independent appraiser",
    "notes_internal": null
  },
  {
    "id": "entity-0025",
    "name": "Brill",
    "entity_type": "Individual - Board member",
    "notes_internal": null
  },
  {
    "id": "entity-0027",
    "name": "Brown Harris Stevens",
    "entity_type": "Entity - real estate brokerage",
    "notes_internal": null
  },
  {
    "id": "entity-0028",
    "name": "CLM Law Firm",
    "entity_type": "Law Firm",
    "notes_internal": null
  },
  {
    "id": "entity-0029",
    "name": "Carolyn Bessette Kennedy",
    "entity_type": "Person",
    "notes_internal": null
  },
  {
    "id": "entity-0030",
    "name": "Charles Berry",
    "entity_type": "Individual; attorney representing Bleich",
    "notes_internal": null
  },
  {
    "id": "entity-0031",
    "name": "Chris Martin",
    "entity_type": "Person - musician (Coldplay frontman)",
    "notes_internal": null
  },
  {
    "id": "entity-0032",
    "name": "Clerk of the Court",
    "entity_type": "Court administrative officer",
    "notes_internal": null
  },
  {
    "id": "entity-0033",
    "name": "Cole Schotz",
    "entity_type": "Law firm - opposing counsel",
    "notes_internal": null
  },
  {
    "id": "entity-0034",
    "name": "Commercial Division, NY County Supreme Court",
    "entity_type": "Court subdivision",
    "notes_internal": null,
    "aliases": [
      "NY County Supreme Court"
    ]
  },
  {
    "id": "entity-0035",
    "name": "Compass",
    "entity_type": "Entity; real estate brokerage firm",
    "notes_internal": null
  },
  {
    "id": "entity-0036",
    "name": "Condominium",
    "entity_type": "Real property - multi-unit structure",
    "notes_internal": null
  },
  {
    "id": "entity-0037",
    "name": "David Kornmeier",
    "entity_type": "Person - broker, Brown Harris Stevens",
    "notes_internal": null,
    "aliases": [
      "Broker Kornmeier",
      "Kornmeier"
    ]
  },
  {
    "id": "entity-0038",
    "name": "Department of Buildings",
    "entity_type": "Regulatory agency",
    "notes_internal": null
  },
  {
    "id": "entity-0039",
    "name": "Direxion Daily Financial Bear 3X (ticker FAZ)",
    "entity_type": "ETF/Security",
    "notes_internal": null
  },
  {
    "id": "entity-0040",
    "name": "EC Architects",
    "entity_type": "Organization - Architecture firm",
    "notes_internal": null
  },
  {
    "id": "entity-0043",
    "name": "Elcherbini Architects",
    "entity_type": "Expert/professional firm",
    "notes_internal": null,
    "aliases": [
      "Elcherbini (Elcherbini Architects, AIA)"
    ]
  },
  {
    "id": "entity-0044",
    "name": "EntryPoint Capital, LLC",
    "entity_type": "SEC-registered investment adviser; CRD# 313946; Cayman Islands master-feeder structure",
    "notes_internal": null
  },
  {
    "id": "entity-0045",
    "name": "FINRA",
    "entity_type": "Regulatory Organization",
    "notes_internal": null,
    "aliases": [
      "FINRA and NASDAQ"
    ]
  },
  {
    "id": "entity-0047",
    "name": "Felix",
    "entity_type": "Individual attorney - defendant's counsel",
    "notes_internal": null
  },
  {
    "id": "entity-0048",
    "name": "Financial Crimes Task Force",
    "entity_type": "Law Enforcement",
    "notes_internal": null
  },
  {
    "id": "entity-0050",
    "name": "First Department (Appellate Division)",
    "entity_type": "Appellate Court",
    "notes_internal": null,
    "aliases": [
      "First Department"
    ]
  },
  {
    "id": "entity-0051",
    "name": "Geraci",
    "entity_type": "Code consulting expert",
    "notes_internal": null
  },
  {
    "id": "entity-0053",
    "name": "Gwyneth Paltrow",
    "entity_type": "Person - actress",
    "notes_internal": null
  },
  {
    "id": "entity-0054",
    "name": "HD Contractors",
    "entity_type": "Contractor/expert firm",
    "notes_internal": null
  },
  {
    "id": "entity-0055",
    "name": "HLZAE",
    "entity_type": "expert firm; engineering/building science consultant",
    "notes_internal": null
  },
  {
    "id": "entity-0056",
    "name": "Irene Vogt",
    "entity_type": "individual; Unit 2 resident; owner",
    "notes_internal": null
  },
  {
    "id": "entity-0057",
    "name": "JP Engineering Consultants",
    "entity_type": "Expert/professional firm",
    "notes_internal": null
  },
  {
    "id": "entity-0058",
    "name": "James Powers",
    "entity_type": "Individual - Licensed professional engineer, JP Engineering Consultants",
    "notes_internal": null
  },
  {
    "id": "entity-0059",
    "name": "Jay-Z",
    "entity_type": "Person - musician and real estate investor",
    "notes_internal": null
  },
  {
    "id": "entity-0060",
    "name": "Jeremy Phillips",
    "entity_type": "Person - financier",
    "notes_internal": null
  },
  {
    "id": "entity-0061",
    "name": "Jessica Biel",
    "entity_type": "Person - actress",
    "notes_internal": null
  },
  {
    "id": "entity-0062",
    "name": "John F. Kennedy Jr.",
    "entity_type": "Person - publisher",
    "notes_internal": null
  },
  {
    "id": "entity-0063",
    "name": "Josue Pe\u00f1a",
    "entity_type": "individual; MEP technician; NY Brownstone LLC",
    "notes_internal": null
  },
  {
    "id": "entity-0065",
    "name": "Judge Janis Sammartino",
    "entity_type": "Judicial Officer",
    "notes_internal": null
  },
  {
    "id": "entity-0066",
    "name": "Justice Judy H. Kim",
    "entity_type": "Judicial officer",
    "notes_internal": null
  },
  {
    "id": "entity-0067",
    "name": "Justice Mary V. Rosado",
    "entity_type": "judge; New York County Supreme Court, Part 33",
    "notes_internal": null,
    "aliases": [
      "Justice Rosado",
      "Rosado"
    ]
  },
  {
    "id": "entity-0069",
    "name": "Justice Roth",
    "entity_type": "Judicial officer",
    "notes_internal": null
  },
  {
    "id": "entity-0070",
    "name": "Justice Schumacher",
    "entity_type": "Judge",
    "notes_internal": null
  },
  {
    "id": "entity-0071",
    "name": "Justice W. Franc Perry",
    "entity_type": "judge; New York County Supreme Court",
    "notes_internal": null
  },
  {
    "id": "entity-0072",
    "name": "Justin Timberlake",
    "entity_type": "Person - musician and actor",
    "notes_internal": null
  },
  {
    "id": "entity-0073",
    "name": "Katy Perry",
    "entity_type": "Person - musician",
    "notes_internal": null
  },
  {
    "id": "entity-0074",
    "name": "Kerzners",
    "entity_type": "Individuals; former building owners",
    "notes_internal": null
  },
  {
    "id": "entity-0076",
    "name": "Lazare Potter Giacovas & Moyle LLP",